{
  "harness": "claude",
  "model_profile": "local-code-standard",
  "effort": "medium",
  "cost_class": "free",
  "entitlement_pool": null,
  "metered": false,
  "placement_policy": "prefer-warm-local",
  "placement_required": true,
  "catalog_version": "sha256:a423d435435714673791bda1312e26556d722f30063f25df17149bfc427004ce",
  "catalog_document_version": "1.6.0",
  "expires_at": "2099-01-01T00:00:00Z",
  "task": {
    "story_id": "STORY-EXAMPLE-6",
    "title": "a local attempt, used with both an expired and a fresh evidence fixture - the SAME stamp both times",
    "tags": []
  },
  "override": null
}
