{
  "harness": "claude",
  "model_profile": "claude/strong",
  "effort": "xhigh",
  "cost_class": "subscription",
  "entitlement_pool": "anthropic-max",
  "metered": false,
  "placement_policy": "prefer-warm-local",
  "placement_required": false,
  "catalog_version": "sha256:2fd681e0e988bf6be94b8923b1485a0aa174a4e66aec580a2d383c764b60e229",
  "catalog_document_version": "1.3.0",
  "expires_at": "2099-01-01T00:00:00Z",
  "task": {
    "story_id": "STORY-EXAMPLE-2",
    "title": "operator override that still satisfies every hard rule",
    "tags": []
  },
  "override": {
    "actor": "josh",
    "at": "2026-08-20T11:00:00Z",
    "original": {
      "harness": "claude",
      "model_profile": "local-code-standard"
    },
    "reason": "the change needs judgement the local profile cannot provide"
  }
}
