{
  "harness": "claude",
  "model_profile": "local-code-standard",
  "effort": "medium",
  "cost_class": "free",
  "entitlement_pool": null,
  "metered": false,
  "placement_policy": "prefer-warm-local",
  "placement_required": true,
  "catalog_version": "sha256:9b7ba27e367f8cfa0caeed4057fe0fab1cd4138b11f9f65f906822276bfa5e20",
  "catalog_document_version": "1.4.0",
  "expires_at": "2099-01-01T00:00:00Z",
  "task": {
    "story_id": "STORY-EXAMPLE-5",
    "title": "placement_required but no PlacementEvidence was supplied",
    "tags": []
  },
  "override": null
}
