{
  "harness": "claude",
  "model_profile": "claude/strong",
  "effort": "xhigh",
  "cost_class": "subscription",
  "entitlement_pool": "anthropic-max",
  "metered": false,
  "placement_policy": "prefer-warm-local",
  "placement_required": false,
  "catalog_version": "sha256:9b7ba27e367f8cfa0caeed4057fe0fab1cd4138b11f9f65f906822276bfa5e20",
  "catalog_document_version": "1.4.0",
  "expires_at": "2099-01-01T00:00:00Z",
  "task": {
    "story_id": "STORY-EXAMPLE-1",
    "title": "an unmodified router recommendation",
    "tags": ["security", "iam"]
  },
  "override": null
}
