{
  "harness": "claude",
  "model_profile": "claude/strong",
  "effort": "xhigh",
  "cost_class": "subscription",
  "entitlement_pool": "anthropic-max",
  "metered": false,
  "placement_policy": "prefer-warm-local",
  "placement_required": false,
  "catalog_version": "sha256:0123456789abcdef0123456789abcdef0123456789abcdef0123456789abcdef",
  "expires_at": "2099-01-01T00:00:00Z",
  "task": {
    "story_id": "STORY-EXAMPLE-4",
    "title": "stamped against a catalog digest the loaded catalog no longer is",
    "tags": []
  },
  "override": null
}
