{
  "harness": "claude",
  "model_profile": "claude/strong",
  "effort": "xhigh",
  "cost_class": "subscription",
  "entitlement_pool": "anthropic-max",
  "metered": false,
  "placement_policy": "prefer-warm-local",
  "placement_required": false,
  "catalog_version": "sha256:c4d49d9a9db3b203cab02200dc0e335ae3b02934d91fe81b08975d5acc7cd027",
  "catalog_document_version": "1.6.0",
  "expires_at": "2000-01-01T00:00:00Z",
  "created_at": "2026-08-20T23:59:59Z",
  "task": {
    "story_id": "STORY-EXAMPLE-7",
    "title": "expires_at is already in the past even though created_at looks recent - created_at grants no fresh window",
    "tags": []
  },
  "override": null
}
