{
  "harness": "claude",
  "model_profile": "local-code-standard",
  "effort": "medium",
  "cost_class": "free",
  "entitlement_pool": null,
  "metered": false,
  "placement_policy": "prefer-warm-local",
  "placement_required": true,
  "catalog_version": "sha256:c4d49d9a9db3b203cab02200dc0e335ae3b02934d91fe81b08975d5acc7cd027",
  "expires_at": "2099-01-01T00:00:00Z",
  "task": {
    "story_id": "STORY-EXAMPLE-9",
    "title": "operator override to a pairing forbidden for this task's tags - SYNTHETIC: validated against a catalog copy where local-code-standard.forbidden_for includes security",
    "tags": ["security"]
  },
  "override": {
    "actor": "josh",
    "at": "2026-08-20T11:00:00Z",
    "original": {
      "harness": "claude",
      "model_profile": "local-general"
    },
    "reason": "operator chose deliberately"
  }
}
