{
  "harness": "claude",
  "model_profile": "claude/strong",
  "effort": "xhigh",
  "cost_class": "metered",
  "entitlement_pool": "anthropic-max",
  "metered": true,
  "placement_policy": "prefer-warm-local",
  "placement_required": false,
  "catalog_version": "sha256:a423d435435714673791bda1312e26556d722f30063f25df17149bfc427004ce",
  "catalog_document_version": "1.6.0",
  "expires_at": "2099-01-01T00:00:00Z",
  "task": {
    "story_id": "STORY-EXAMPLE-8",
    "title": "metered intent with no ValidationContext authority - the MVP CLI supplies none, ever",
    "tags": []
  },
  "override": null
}
